{
  "schema_version": 1,
  "sprint_id": "SPRINT-TEST",
  "execution_mode": "v1",
  "sprint_status": "Active",
  "stories": {
    "STORY-TEST-01": {
      "state": "Bouncing",
      "qa_bounces": 0,
      "arch_bounces": 0,
      "worktree": null,
      "updated_at": "2026-04-27T00:00:00Z",
      "notes": "legacy v1 fixture — no lane field for test_pre_gate_lane_aware.sh"
    }
  },
  "last_action": "fixture",
  "updated_at": "2026-04-27T00:00:00Z"
}
