{
  "schema_version": 1,
  "sprint_id": "SPRINT-TEST",
  "execution_mode": "v2",
  "sprint_status": "Active",
  "stories": {
    "STORY-TEST-01": {
      "state": "Ready to Bounce",
      "qa_bounces": 0,
      "arch_bounces": 0,
      "worktree": null,
      "updated_at": "2026-01-01T00:00:00.000Z",
      "notes": ""
    },
    "STORY-TEST-02": {
      "state": "Bouncing",
      "qa_bounces": 1,
      "arch_bounces": 0,
      "worktree": "/tmp/worktree-02",
      "updated_at": "2026-01-02T00:00:00.000Z",
      "notes": "second story"
    },
    "STORY-TEST-03": {
      "state": "QA Passed",
      "qa_bounces": 0,
      "arch_bounces": 1,
      "worktree": null,
      "updated_at": "2026-01-03T00:00:00.000Z",
      "notes": ""
    }
  },
  "last_action": "init",
  "updated_at": "2026-01-01T00:00:00.000Z"
}
