{
  "schema_version": 1,
  "sprint_id": "SPRINT-10",
  "execution_mode": "v2",
  "sprint_status": "Completed",
  "stories": {
    "STORY-014-01": {
      "state": "Done",
      "qa_bounces": 0,
      "arch_bounces": 0,
      "worktree": null,
      "updated_at": "2026-04-22T07:47:04.088Z",
      "notes": ""
    },
    "STORY-014-02": {
      "state": "Done",
      "qa_bounces": 0,
      "arch_bounces": 0,
      "worktree": null,
      "updated_at": "2026-04-22T07:47:04.146Z",
      "notes": ""
    },
    "STORY-014-03": {
      "state": "Done",
      "qa_bounces": 0,
      "arch_bounces": 0,
      "worktree": null,
      "updated_at": "2026-04-22T07:47:04.199Z",
      "notes": ""
    },
    "STORY-014-04": {
      "state": "Done",
      "qa_bounces": 0,
      "arch_bounces": 0,
      "worktree": null,
      "updated_at": "2026-04-22T07:47:04.254Z",
      "notes": ""
    },
    "STORY-014-05": {
      "state": "Done",
      "qa_bounces": 0,
      "arch_bounces": 0,
      "worktree": null,
      "updated_at": "2026-04-22T07:47:04.311Z",
      "notes": ""
    },
    "STORY-014-06": {
      "state": "Done",
      "qa_bounces": 0,
      "arch_bounces": 0,
      "worktree": null,
      "updated_at": "2026-04-22T07:47:04.366Z",
      "notes": ""
    },
    "STORY-014-07": {
      "state": "Done",
      "qa_bounces": 0,
      "arch_bounces": 0,
      "worktree": null,
      "updated_at": "2026-04-22T07:47:04.421Z",
      "notes": ""
    },
    "STORY-014-08": {
      "state": "Done",
      "qa_bounces": 0,
      "arch_bounces": 0,
      "worktree": null,
      "updated_at": "2026-04-22T07:47:04.477Z",
      "notes": ""
    },
    "STORY-014-09": {
      "state": "Done",
      "qa_bounces": 0,
      "arch_bounces": 0,
      "worktree": null,
      "updated_at": "2026-04-22T07:47:04.533Z",
      "notes": ""
    },
    "STORY-014-10": {
      "state": "Done",
      "qa_bounces": 0,
      "arch_bounces": 0,
      "worktree": null,
      "updated_at": "2026-04-22T07:47:04.590Z",
      "notes": ""
    }
  },
  "last_action": "close_sprint: sprint SPRINT-10 completed",
  "updated_at": "2026-04-22T07:48:57.804Z"
}
